{
  "id": "ART-20260906-035",
  "kind": "change-set",
  "version": 2,
  "status": "final",
  "producer": {
    "agent": "build-orchestrator",
    "run": "claude-session-0131kn5rsn1dnuKVXft3KSXp-security-fix-2"
  },
  "created": "2026-09-06",
  "title": "Change set v2: close F1 of ART-20260906-034 (project-less issues) alongside the original bypass",
  "traces": [
    "ART-20260906-030",
    "ART-20260906-032"
  ],
  "supersedes": "ART-20260906-033",
  "approvals": [],
  "body": {
    "branch": "feat/ART-20260906-030",
    "base": "2630e91547f821629ee74883668ec49614b847b3",
    "commits": [
      "9e1d9608180a8d254a8b14d88b2ad4ee6c7ef32c",
      "0f85ff4d6bc5850e707355f8ae75fb6493cf2ff8"
    ],
    "files": [
      {
        "path": "lib/workspace.ts",
        "workstream": "reducer"
      },
      {
        "path": "scripts/scenario-validation.ts",
        "workstream": "proof"
      },
      {
        "path": "data/validation.json",
        "workstream": "proof"
      },
      {
        "path": "app/api/mail/file/route.ts",
        "workstream": "route"
      }
    ],
    "plan_ref": "ART-20260906-032",
    "self_validation": {
      "commands": [
        "npx tsc --noEmit",
        "npm run audit:tenancy",
        "npm run audit:attribution",
        "npm run audit:contracts",
        "npm run validate:scenarios"
      ],
      "passed": true
    },
    "review": {
      "findings_confirmed": 0,
      "findings_open": 0,
      "verdict": "fixed",
      "findings": [
        {
          "title": "F1 of ART-20260906-034: project-less issues had no staffing gate on recordInboundMail",
          "file": "app/api/mail/file/route.ts",
          "detail": "A resolved project of null (an issue parented directly under a client or engagement, which canParent permits) left evidence.add as the sole gate on both create and attach modes. ROLE_CLIENT_SPONSOR and ROLE_CLIENT_LEAD both hold evidence.add, so a client seat could reach any project-less issue in the tenant, not only their own client's.",
          "failureScenario": "A client sponsor attaches fabricated mail evidence to a structural issue outside their own client's scope, with no project to check staffing against.",
          "severity": "medium"
        }
      ],
      "resolution": "Both branches (create, keyed on body.parentId; attach, keyed on the resolved target) now require can(state.model, session.actor, 'internal.view') whenever projectOf returns null, mirroring the internal/client boundary the client-filter work (ART-20260905-023) already established. Scenario CD14 proves the two conditions the route depends on: projectOf returns null for a client-parented issue, and internal.view distinguishes a client-role actor (who still holds evidence.add) from an internal one. Verified directly: every other recordInboundMail construction site in the repository is the machine intake path (exempt by isMachineActor, unaffected) or a test/proof script, confirmed by grep across the full tree."
    }
  }
}
